{
  "schema_version": "go.dispatch-result.v1",
  "go_run_id": "a1b2c3d4-e5f6-7890-abcd-ef1234567890",
  "terminal_id": "console_a1b2c3d4",
  "task_id": "TASK-17",
  "route": "refactor",
  "delegated_skill": "/refactor",
  "dispatch_status": "dispatched",
  "delegated_at": "2026-04-20T10:01:05Z",
  "expected_outcome_type": "refactor-result",
  "orchestrator_wait_state": "awaiting-skill-outcome",
  "final_status": "awaiting",
  "produced_artifacts": [],
  "skill_output_refs": [],
  "notes": "/refactor has been dispatched. Awaiting skill completion and outcome artifact."
}
